<?xml version="1.0"?>
<!DOCTYPE tablebase SYSTEM "http://www.freesoft.org/software/hoffman/tablebase.dtd">
<!-- Created by genctlfile.pl -->
<!-- Modified by hand to use Nalimov instead of Hoffman futurebase -->

<tablebase>
   <dtm/>
   <piece color="white" type="king"/>
   <piece color="black" type="king"/>
   <piece color="white" type="pawn"/>
   <piece color="black" type="pawn"/>
   <futurebase filename="kpk.nbw.emd"/>
   <futurebase filename="kqkp.nbw.emd"/>
   <futurebase filename="krkp.nbw.emd"/>
   <futurebase filename="kbkp.nbw.emd"/>
   <futurebase filename="knkp.nbw.emd"/>
   <output filename="kpkp_nalimov.htb"/>
</tablebase>
