<?xml version="1.0"?>
<!DOCTYPE tablebase SYSTEM "http://www.freesoft.org/software/hoffman/tablebase.dtd">
<!-- Diagram 67 from Rubin Fine's "Basic Chess Endings" -->

<tablebase>
   <prune-enable color="white" type="concede"/>
   <prune-enable color="black" type="concede"/>
   <dtm/>
   <piece color="white" type="king"/>
   <piece color="black" type="king"/>
   <piece color="white" type="pawn" location="b3+"/>
   <piece color="black" type="pawn" location="b5+"/>
   <piece color="white" type="pawn" location="c2+"/>
   <piece color="black" type="pawn" location="c7+"/>
   <piece color="white" type="pawn" location="d3+"/>
   <piece color="black" type="pawn" location="d5+"/>
   <futurebase filename="kpk.htb"/>
   <futurebase filename="kpk.htb" colors="invert"/>
   <prune color="white" type="concede" move="P=?"/>
   <prune color="black" type="concede" move="P=?"/>
</tablebase>
