<?xml version="1.0"?>
<!DOCTYPE tablebase SYSTEM "http://www.freesoft.org/software/hoffman/tablebase.dtd">
<!-- Created by genctlfile.pl -->
<!-- Modified by hand to use Syzygy instead of Hoffman futurebase -->

<tablebase>
   <dtc/>
   <piece color="white" type="king"/>
   <piece color="black" type="king"/>
   <piece color="white" type="pawn"/>
   <piece color="black" type="pawn"/>
   <futurebase filename="KPvK.rtbw"/>
   <futurebase filename="KQvKP.rtbw"/>
   <futurebase filename="KRvKP.rtbw"/>
   <futurebase filename="KBvKP.rtbw"/>
   <futurebase filename="KNvKP.rtbw"/>
   <output filename="kpkp_syzygy.htb"/>
</tablebase>
