<?xml version="1.0"?>
<!DOCTYPE tablebase SYSTEM "http://www.freesoft.org/software/hoffman/tablebase.dtd">
<!-- Diagram 67 from Rubin Fine's "Basic Chess Endings" -->
<!-- Problem position 8/2p5/3k4/1p1p1K2/8/1P1P4/2P5/8 w -->

<tablebase>
   <prune-enable color="white" type="discard"/>
   <prune-enable color="black" type="concede"/>
   <dtm/>
   <piece color="white" type="king"/>
   <piece color="white" type="pawn" location="b3+"/>
   <piece color="white" type="pawn" location="c2+"/>
   <piece color="white" type="pawn" location="d3+"/>
   <piece color="black" type="king"/>
   <piece color="black" type="pawn" location="b5+"/>
   <piece color="black" type="pawn" location="c7+"/>
   <piece color="black" type="pawn" location="d5+"/>
   <futurebase filename="kpkp.htb"/>
   <futurebase filename="kppk.htb"/>
   <futurebase filename="kppk.htb" colors="invert"/>
   <futurebase filename="kqkp.htb"/>
   <futurebase filename="kqpk.htb"/>
   <prune color="white" type="discard" move="P=Q" pawngen-condition="grep(/Q/,@white_pieces)==1"/>
   <prune color="white" type="discard" move="P=[RNB]"/>
   <prune color="black" type="concede" move="P*=?"/>
   <prune color="black" type="concede" move="?xQ"/>
   <prune color="black" type="concede" move="?xP" pawngen-condition="grep(/Q/,@white_pieces)==0 and $#white_pawns==0"/>
</tablebase>
